{
    "Name": "wise",
    "DefaultCurrency": "EUR",
    "SubAccounts": "Assets:Banks:Wise:Cash",
    "UndefinedAccount" : "Expenses:Wise:Unregistered",
    "input":"Files/input/Wise",
    "DateColumn": "Date",
    "DateFormat": "%d-%m-%Y",
    "separator": ",",
    "RulesTable": "Files/config/private/rules_Wise.csv",
    "RulesTable_Separator": ";"

}